{
  "$schema": "https://json-schema.org/draft/2020-12/schema",
  "$id": "https://github.com/123xiaoxin/master-orchestrator/schemas/task_analysis.v1.schema.json",
  "title": "Master Orchestrator Task Analysis v1",
  "description": "Compiled task profile containing intent, goal, non-goals, deliverables, constraints, success criteria, environment evidence, capability mapping, and routing.",
  "type": "object",
  "additionalProperties": false,
  "required": [
    "schemaVersion",
    "intent",
    "goal",
    "nonGoals",
    "deliverables",
    "constraints",
    "successCriteria",
    "environmentSnapshot",
    "capabilityMapping",
    "routingDecision"
  ],
  "properties": {
    "schemaVersion": {
      "const": "task_analysis.v1"
    },
    "intent": {
      "type": "string",
      "minLength": 1
    },
    "goal": {
      "type": "string",
      "minLength": 1
    },
    "nonGoals": {
      "type": "array",
      "minItems": 1,
      "items": {
        "type": "string",
        "minLength": 1
      }
    },
    "deliverables": {
      "type": "array",
      "minItems": 1,
      "items": {
        "type": "string",
        "minLength": 1
      }
    },
    "constraints": {
      "type": "array",
      "items": {
        "type": "string",
        "minLength": 1
      }
    },
    "successCriteria": {
      "type": "array",
      "minItems": 1,
      "items": {
        "type": "string",
        "minLength": 1
      }
    },
    "environmentSnapshot": {
      "type": "object",
      "additionalProperties": true,
      "required": [
        "maxSpawnDepth",
        "maxChildrenPerAgent",
        "expertLibraryAvailable",
        "userAgentsBypassed"
      ],
      "properties": {
        "maxSpawnDepth": {
          "type": [
            "integer",
            "null"
          ]
        },
        "maxChildrenPerAgent": {
          "type": [
            "integer",
            "null"
          ]
        },
        "availableModels": {
          "type": "array",
          "items": {
            "type": "string"
          }
        },
        "expertLibraryAvailable": {
          "type": "boolean"
        },
        "userAgentsBypassed": {
          "const": true
        }
      }
    },
    "capabilityMapping": {
      "type": "array",
      "minItems": 1,
      "items": {
        "type": "object",
        "additionalProperties": false,
        "required": [
          "capability",
          "required",
          "matchedBy",
          "fallback"
        ],
        "properties": {
          "capability": {
            "type": "string",
            "minLength": 1
          },
          "required": {
            "type": "boolean"
          },
          "matchedBy": {
            "type": "string"
          },
          "fallback": {
            "type": "string"
          }
        }
      }
    },
    "routingDecision": {
      "type": "object",
      "additionalProperties": false,
      "required": [
        "mode",
        "reason",
        "agentCount"
      ],
      "properties": {
        "mode": {
          "enum": [
            "master_only",
            "create_temp_agent",
            "create_subagent",
            "create_agent_pack",
            "staged_execution",
            "downgrade_or_clarify"
          ]
        },
        "reason": {
          "type": "string",
          "minLength": 1
        },
        "agentCount": {
          "type": "integer",
          "minimum": 0,
          "maximum": 5
        }
      }
    },
    "microSops": {
      "type": "array",
      "items": {
        "$ref": "micro_sop.v1.schema.json"
      }
    }
  },
  "examples": [
    {
      "schemaVersion": "task_analysis.v1",
      "intent": "Validate a documentation-only change.",
      "goal": "Confirm links, encoding, and documented commands remain correct.",
      "nonGoals": ["Do not modify runtime behavior."],
      "deliverables": ["Validation report."],
      "constraints": ["Read-only validation."],
      "successCriteria": ["Encoding and link checks pass."],
      "environmentSnapshot": {
        "maxSpawnDepth": 2,
        "maxChildrenPerAgent": 5,
        "availableModels": [],
        "expertLibraryAvailable": true,
        "userAgentsBypassed": true
      },
      "capabilityMapping": [
        {
          "capability": "documentation-validation",
          "required": true,
          "matchedBy": "",
          "fallback": "master_only"
        }
      ],
      "routingDecision": {
        "mode": "master_only",
        "reason": "The task is small, read-only, and directly verifiable.",
        "agentCount": 0
      }
    }
  ]
}
